{
  "object": "list",
  "data": [
    {
      "object": "embedding",
      "index": 0,
      "embedding": [
        -0.00623, 0.01234, -0.00891, 0.02456, -0.01567, 0.00345, -0.02789,
        0.01678, -0.00432, 0.03210, -0.01890, 0.00567, -0.02345, 0.01456,
        -0.00789, 0.02567, -0.01234, 0.00891, -0.03456, 0.01789
      ]
    }
  ],
  "model": "text-embedding-ada-002",
  "usage": {
    "prompt_tokens": 18,
    "total_tokens": 18
  }
}
